name,def,category
운용보고서,"펀드가 어떻게 운용되고 투자결과가 어떠한지를 설명하는 보고서. 주요 내용은 특정 기간 중의 운용경과의 개요,
 자산/부채 등에 관한 사항, 각 유가증권의 포트폴리오에 관한 사항, 운용전문인력에 관한 사항 등임",퇴직연금
위험허용도,"투자자들의 투자 가치의 변동에 대해 감수할 수 있는 정도를 뜻하며, 일반적으로 고객들의 투자성향을 나타냄",퇴직연금
임금채권보장기금제도 ,"도산기업에서 퇴직한 근로자들의 최소한의 생활안정을 위해 체불된 퇴직前 3개월분 임금(휴업수당 포함) 및 3년분 
퇴직금을 기업의 부담금 등으로 조성한 임금채권보장기금에서 지급하는 제도",퇴직연금
적립방식 (Accumulation method) ,"퇴직연금 및 개인연금 등 사적연금에서 주로 쓰이는 방식으로 근로세대는 임금 및 소득 중 일부를 부담금으로 납부하고, 
이에 의하여 적립되는 금액과 운용수익으로 은퇴 이후의 연금을 지급받는 방법",퇴직연금
적격퇴직연금,"일본에서 1962년에 도입된 제도로서, 법인세법上 13가지 적격요건을 충족하고, 국세청에 승인을 득한 퇴직연금계약. 
2002년 4월 확정급여형퇴직연금법의 시행으로 신규설립은 금지되었으며 기존 연금은 2012년까지 확정급여형(DB)제도다른 제도로 전환하여야 함.",퇴직연금
정액분할투자,"부담금을 한꺼번에 투자하지 않고 일정금액씩 주기적으로 나누어 평균 기준가격으로 투자함으로써 기준가격 변동의
 불안정성을 일정 부분 Hedge하여 투자하는 기능으로, 주로 거액을 일시에 납입할 경우 펀드로 자금을 한번에 투입시 그 시점의 시장의 상황에 수익률이 크게 좌우되는 불안정성을 완화하기 위해 개발된 기능",퇴직연금
기산일,"퇴직연금에서는 퇴직급여 산정 기초일/퇴직금 지급에 있어서 퇴직한 날, 사고가 발생한 날 등 금액 산출을 위한 시작일 
혹은 기초일",퇴직연금
정액정기투자,"부담금을 한꺼번에 투자하지 않고 일정금액씩 주기적으로 나누어 평균기준가격으로 투자함으로써 기준가격 변동의 
불안정성을 일정부분 Hedge하여 투자하는 기능. 일시납부담금 등 주로 고액자금을 일시에 납입할 경우 펀드로 자금을 한번에 투입시 그 시점의 시장의 흐름에 수익률이 크게 좌우되는 불안정성을 완화하기 위해 개발된 기능",퇴직연금
채권형펀드,주식에는 전혀 투자하지 않고 채권 및 채권관련 파생상품에 주로 투자하여 상대적으로 안정적인 수익을 추구하는 펀드,퇴직연금
캐쉬밸런스 제도 (Cash Balance Plan) ,"확정급여형(DB)제도와 확정기여형(DC)제도의 장점을 혼합한 제도. 최소한의 퇴직급여가 정해져 있으며 기업이 적립금을 
운용한다는 점에서 확정급여형(DB)제도와 유사하고, 근로자 별로 가상계좌가 설정되며 추가수익이 발생하면 근로자에게 돌아간다는 점에서 확정기여형(DC)제도와 유사함.",퇴직연금
퇴직보험,"퇴직금제도에서 기업이 퇴직급여를 사외에 예치하고 퇴직시에 근로자가 직접 지급받을 수 있는 보험. 
2011년부터 추가 적립 및 신규 가입이 금지됨.",퇴직연금
퇴직연금제도,"기업이 임직원의 노후소득을 보장하기 위해 재직 중에 퇴직급여 재원을 별도의 금융기관에 적립하고 근로자가 퇴직할 때
 일시금 또는 연금형태로 지급하는 기업복지제도. 확정기여형과 확정급여형(DB) 퇴직연금제도가 있음.",퇴직연금
혼합형펀드,"주식형이나 채권형 이외의 펀드로 주식과 채권의 효율적 자산 배분을 통해 주식의 수익성과 채권의 안정성을 동시에 
추구하는 펀드. 주식에 상대적으로 더 많이 투자하는 주식혼합형과 채권에 상대적으로 더 많이 투자하는 채권혼합형으로 나뉨.",퇴직연금
확정급여형 퇴직연금 (Defined Benefit Plan) ,"근로자가 받게 될 퇴직급여를 사전에 연금규약에 정해진 급여공식에 의해 산출하고 부담금 수준은 적립금의 운용수익에
 따라 변동되는 퇴직연금제도",퇴직연금
확정기여형 퇴직연금 (Defined Contribution Plan) ,"사용자의 부담금 수준이 미리 확정되어 있고, 퇴직급여 수준이 개인계좌의 적립금 운용수익에 따라 변동되는 퇴직연금제도",퇴직연금
환매,"판매회사가 고객에게 매각한 수익증권을 고객의 요청에 따라 일정한 조건 (환매수수료 부과) 등으로 판매회사가 다시 
매입하는 것. 개방형 뮤추얼펀드는 언제든 환매가 가능하나, 폐쇄형 뮤추얼펀드는 만기까지 환매가 불가능함.",퇴직연금
환매수수료,"정해진 투자기간 이전에 펀드를 환매(투자자의 입장에서는 출금 또는 해지)할 때 부과되는 수수료. 수익자의 환매를 
억제함으로써 투자신탁의 운용에 안정을 기하고 환매에 따른 사무처리 비용에 충당하기 위해 징구하는 일종의 중도해지 수수료의 성격을 지님",퇴직연금